,id_news,country,media_outlet,url,title,text,date,search
0,47318436.0,chile,radioacogida,https://radioacogida.cl/4823-titulos-de-dominio-se-han-entregado-en-la-region-de-los-lagos/,4823 títulos de dominio se han entregado en la region de Los Lagos,"El seremi de Bienes Nacionales, Jorge Moreno, realizó el balance de los títulos dedominios entregados bajo su gestión, en una ceremonia realizada hoy en el Teatro DiegoRivera, ocasión donde además se entregaron 187 certezas jurídicas a familias de lacomuna de Puerto Montt.“El programa Chile Propietarios, programa emblemático del Ministerio de BienesNacionales, tuvo gracias al Gobierno Regional de Los Lagos, $1.200 millones. Una cifrahistórica que nunca antes la seremía había podido obtener. Dinero destinado a regularizartítulos de dominio y que nos ha permitido entregar más de 4.800 títulos de dominio enestos cuatro años de gestión”, indicó el Seremi Jorge Moreno.Entendiendo que el Títulos de Dominio, tiene como objetivo mejorar la calidad de vida delas familias. Busca, además, que las personas puedan acceder a los múltiples beneficiosque entrega el Estado, tales como: pavimentación de calles; subsidios habitacionales, deagua potable y alcantarillado; créditos INDAP; financiamiento proyectos Sercotec ycréditos hipotecarios en bancos e instituciones financieras, entre otros.De los casi cinco mil documentos legales entregados desde el año 2018, 2303corresponden a la provincia de Llanquihue, 1530 a la provincia de Chiloé, 823 a laprovincia de Osorno y 167 a la provincia de Palena.“Hoy estamos cumpliendo un sueño, luego de un gran tiempo de espera, finalmente lolograron, ahora son propietarios”, señaló el Secretario Regional Ministerial, a losbeneficiados. Agregó además que “el ministerio de Bienes Nacionales ha llegado alcorazón de más de 4.800 familias en toda la región. Corazones que tienen en comuna laperseverancia y el esfuerzo”.",2022-03-04,
1,47318442.0,chile,radioacogida,https://radioacogida.cl/seremi-de-educacion-junto-a-delegado-presidencial-dan-inicio-al-ano-escolar-2022/,Seremi de Educación junto a Delegado Presidencial dan inicio al Año Escolar 2022,"Hasta el Colegio San José de Puerto Montt llegó hoy la seremi de Educación, Paulina Lobos y el Delegado Presidencial, Carlos Geisse, y acompañados por otras autoridades de Educación, como el jefe provincial de Educación, Víctor Sánchez; la directora regional de Junaeb, Sarita Cárcamo y la directora regional de la Superintendencia de Educación, Paulina Rettig, dieron el vamos al año escolar 2022. El primer día de clases de este año tiene un carácter diferente a los últimos, porque tras dos años de pandemia es el momento en que los estudiantes deben volver a clases presenciales y se reencuentran con sus compañeros y profesores, y comenzarán el camino de recuperar los aprendizajes perdidos y su desarrollo socioemocional. “Para nosotros es un día sumamente importante y gracias al trabajo realizado por todas las comunidades educativas de la región y la experiencia acumulada en estos casi dos años de pandemia, el inicio del año escolar 2022 fue un éxito. Tuve la posibilidad de contactarme con distintos directores de unidades educativas y la masiva asistencia a clases demostró el interés y compromiso de los alumnos, apoderados y docentes por volver de forma segura a las salas de clases. Este es un paso fundamental para fortalecer la recuperación de los aprendizajes y el desarrollo integral de nuestros niños y jóvenes y debe ser enfrentado como un objetivo común”, precisó la seremi de Educación, Paulina Lobos. Las autoridades recorrieron el establecimiento y conversaron con los alumnos y profesores quienes se mostraron esperanzados por este nuevo año escolar que comienza, el que se da con unos altos índices de vacunación de los estudiantes, donde el 89% de los alumnos entre 6 y 17 años ya cuenta con su esquema de vacunación completo. El Delegado Presidencial Regional, Carlos Geisse quien acompañó a la seremi de Educación Paulina Lobos, manifestó que “hoy estamos dando inicio al año escolar y estamos muy contentos porque la asistencia ha sido mucha casi el 90% de asistencia han tenido el primer día de clases  en este establecimiento y eso nos deja muy contentos porque es relevante que los niños vuelvan a las clases presenciales, porque la clases presenciales es la forma más efectiva para que los niños puedan estudiar y en este caso en un ambiente seguro. La autoridad regional argumentó que “hemos vuelto a la normalidad, a jornada escolar completa pero con todas las medidas de protección porque hay casi el 90% de la población escolar está vacunada y se están  tomando todas las medidas de precaución internas como uso mascarillas, lavado frecuente de manos y otras lo que nos  deja muy conformes y contentos porque a pesar de la pandemia se ha podido seguir avanzando durante todos estos años  en las distintas actividades que desarrolla el ministerio de Educación, distintos programas y proyectos como los 18 nuevos Liceos Bicentenario y eso habla de que la pandemia nos ha frenado pero no nos ha detenido”. Como preparación al inicio del año escolar 2022, el Ministerio de Educación presentó el Protocolo de medidas sanitarias y vigilancia epidemiológica para establecimientos educacionales, con el objetivoque todos los recintos educativos del país conozcan las medidas de prevención para la propagación del COVID-19 que deben seguir en el día a día junto a las comunidades educativas. El instructivo, que fue elaborado en conjunto con el Ministerio de Salud, señala que todos los establecimientos educacionales deben realizar sus actividades y clases de forma presencial, independiente de la fase del Plan Paso a Paso en la que se encuentren. Tanto la apertura de los recintos educativos, como la asistencia presencial de los estudiantes es de carácter obligatoria y se retoma la Jornada Escolar Completa (JEC). Además, se destaca que, debido al alto nivel de vacunación alcanzado en los estudiantes, donde prácticamente el 90% de los escolares ya cuentan con su esquema de vacunación completo, se eliminan las restricciones de aforo en todos los espacios dentro de los establecimientos educacionales, y en la medida de lo posible de cada recinto educativo se insta a propiciar distanciamiento en las actividades cotidianas. Los establecimientos educacionales deberán seguir con medidas de prevención para la propagación del COVID-19, tales como la ventilación permanente de las salas de clases y espacios comunes, uso de mascarillas de acuerdo a las recomendaciones de la Organización Mundial de la Salud (OMS), implementar rutinas de lavado de manos cada 2 o 3 horas, eliminar los saludos que requieran contacto físico, y establecer una serie de recomendaciones para los apoderados y comunidad educativa en general, en diferentes ámbitos del día a día. ",2022-03-02,
2,47326657.0,chile,radiosago,https://www.radiosago.cl/abren-encuesta-para-elegir-proyectos-de-movilidad-y-espacios-urbanos-para-inversion-publica-en-osorno/,Abren encuesta para elegir proyectos de movilidad y espacios urbanos para inversión pública en Osorno,"En el marco del desarrollo de la segunda etapa de la elaboración de los estudios del “Plan de Inversiones en Infraestructura de Movilidad y Espacios Públicos para la comuna de Osorno”, el municipio local está llevando a cabo las encuestas para votar y elegir los proyectos que serán parte de estas inversiones. La primera etapa consistió en la reunión por parte de los profesionales de la Secretaría de Planificación Comunal del municipio, Secplan, con diversas organizaciones comunitarias de Osorno en distintos talleres recogiendo las inquietudes de los vecinos en torno a este tema. Carolina Palma, arquitecta de la Secplan, invitó a participar de la encuesta que se desarrolla de forma online y presencial. La profesional indicó que hay proyectos sugeridos, pero también se puede agregar información respecto de proyectos que le interesen a los propios vecinos que lleguen a contestar la encuesta. La encuesta online está disponible en el sitio de la municipalidad www.municipalidadosorno.cl, mientras que también se puede responder en la Oficina de Informaciones de la Plaza de Armas de lunes a viernes entre las 08:30 y 14:00 horas y por la tarde de 15:00 a 18.10, los días sábado de 10 a 13.40. Por su parte, también se puede contestar en la oficina de informaciones del Mercado Municipal de lunes a viernes, por la mañana de 08:30 a 14:00 y en la tarde de 15:00 a 17:15 horas.",2022-03-05,
3,47326666.0,chile,radiosago,https://www.radiosago.cl/hombre-fallecio-durante-la-madrugada-tras-ser-rescatado-mientras-se-ahogaba-en-el-rio-rahue/,Hombre falleció durante la madrugada tras ser rescatado mientras se ahogaba en el Río Rahue,"Un hombre de 41 años de edad falleció durante la madrugada en el Hospital Base de Osorno, luego de que fuera trasladado hasta dicho recinto asistencial por personal del SAMU desde el sector Parque Francke, donde había sido rescatado mientras se ahogaba en el Río Rahue. Los hechos habrían ocurrido pasadas las diez de la noche del miércoles, cuando carabineros del Retén Pampa Alegre divisaron, en el mencionado sector, a una persona que estaba sentada a la orilla del río, con la mitad de su cuerpo sumergido en él. Ante lo peligroso de la escena, según informaron los propios policías, le pidieron al hombre que saliera del lugar, momento en el que se sumergió completamente en las aguas del Rahue, perdiéndose de la vista de los efectivos policiales. En ese momento, un cabo segundo que formaba parte del grupo policial se lanzó a su rescate, logrando rescatarlo y llevarlo de vuelta a la orilla, aunque permanecía inconsciente, según el parte policial. Samu, bomberos y los mismos Carabineros trabajaron en su reanimación, logrando mantener leves signos vitales y trasladarlo de manera urgente hasta el Hospital Base de la ciudad, donde no resistió y, a eso de las 01:50 horas de la madrugada, falleció. Allí figuraba el oficial de Ronda y personal de la Subcomisaría de Rahue, quienes dieron cuenta al Fiscal de turno y  la familia del individuo.",2022-03-03,
4,47326667.0,chile,radiosago,https://www.radiosago.cl/detectan-a-hombre-que-ofrecia-clases-de-conduccion-sin-autorizacion-en-osorno/,Detectan a hombre que ofrecía clases de conducción sin autorización en Osorno,"Carabineros de la Sección de Investigación de Accidentes de Tránsito, SIAT, de Osorno detectaron a un sujeto ofreciendo cursos prácticos de conducción de automóviles, sin contar con las autorizaciones correspondientes por parte del Ministerio de Transportes. El hombre cobraba cerca de 100 mil pesos por 12 clases de manejo, lo que fue denunciado a la policía, por lo que comenzaron las diligencias investigativas. Así lo informó el jefe de la SIAT Osorno, capitán Francisco De La Vega, detallando que fue fiscalizado la mañana de este jueves en Osorno y que fue denunciado a la autoridad competente, además de ser citado a los tribunales de justicia, los que deberán determinar la sanción que recibirá. El oficial explicó que el sujeto, que utilizaba un automóvil particular y recordó que, además de las labores de investigación de accidentes de tránsito, la SIAT realiza fiscalizaciones a las normas que rigen a las escuelas de conductores, contenidas en el Decreto N°251, del Ministerio de Transporte y Telecomunicaciones. En este sentido, el oficial recalcó la importancia que las personas que están interesadas en aprender a conducir, lo hagan en establecimientos que cumplen con todas las normativas legales y que están certificados por la autoridad.",2022-03-04,
5,47326709.0,chile,radiosago,https://www.radiosago.cl/seremi-de-transportes-ofrece-propuesta-a-operador-de-linea-3-para-retomar-servicio-en-ovejeria/,Seremi de Transportes ofrece propuesta a operador de Línea 3 para retomar servicio en Ovejería,"Luego de que este día martes dejara de operar el recorrido 3B de los microbuses de Osorno, el único que conectaba el sector de Ovejería con el centro y el sector Chuyaca, la autoridad de transportes confirmó que este miércoles por la tarde se llevó a cabo una reunión con los representantes de la empresa para buscar una salida al conflicto por el que abandonaron el trayecto. Cabe recordar que desde la Seremi de Transportes Los Lagos, el titular de la secretaría, Nicolás Céspedes, señaló que el acuerdo para la operación de ese recorrido no adjudicado en la licitación, en el marco del perímetro de exclusión de la comuna, consistía en que lo realizarían durante tres meses, de diciembre a marzo, mientras se adecuaba su asignación y, luego, se le subvencionaría mensualmente con 5,7 millones de pesos extra a lo recibido por el otro recorrido de la línea. Ahora, el seremi accedió a conversar con el representante legal para conocer las demandas del operador, indicando que existe una fórmula para llegar a acuerdo, esperando que sea analizada por la empresa y respondida en las próximas horas. Sin entregar detalles en lo que respecta al acuerdo, la principal reclamación del operador era que se cumplan los compromisos de pagos mensuales por realizar el recorrido cumpliendo con las exigencias del perímetro. El sistema de Perímetro de Exclusión, que funciona desde noviembre en Osorno, contempla frecuencias y horarios controlados de cada una de las máquinas que cumplen con los recorridos, considerando también una extensión horaria para el transporte público mayor de la comuna.",2022-03-03,
6,47326730.0,chile,radiosago,https://www.radiosago.cl/esta-semana-se-firmara-convenio-para-licitar-anteproyecto-de-norma-secundaria-para-rios-rahue-y-damas/,Esta semana se firmará convenio para licitar anteproyecto de norma secundaria para ríos Rahue y Damas,"Hasta el Salón Lámpara del Centro Cultural de Osorno llegó el seremi de Medio Ambiente de la región de Los Lagos Klaus Kosiel, para participar como expositor en la reunión que sostuvo la Comisión de Medio Ambiente del Consejo Regional, previo a la sesión del Core de este miércoles. Kosiel fue convocado para informar el estado de avance de dos iniciativas que competen a la provincia de Osorno; lo que será la licitación de la elaboración del anteproyecto de la norma técnica secundaria de los ríos Rahue y Damas, que establezcan los parámetros de conservación y cuidado de ambos afluentes, y el avance de la solicitud de declaratoria de Humedal Urbano del Predio Baquedano en Osorno. Respecto del informe para la norma secundaria de los ríos osorninos, el seremi aseguró que esta semana se firmará el convenio entre la secretaría y el gobierno regional, por lo que próximamente ya se podrá licitar el trabajo. Esto sería la antesala de la elaboración de la norma y todos los estudios que se deben hacer, lo que debe entrar en el presupuesto ampliado del gore 2022. En tanto, Kosiel también destacó que de aquí a junio o julio de este año se debe resolver la declaratoria de humedal urbano de los acuíferos ubicados en el predio Baquedano en Osorno. Kosiel afirmó que hasta ahora, son 500 hectáreas que ya fueron declaradas como Humedales Urbanos en la región, correspondientes a 12 humedales, y actualmente hay otros 30 en proceso de espera a la resolución del Ministerio.",2022-03-02,
7,47326797.0,chile,radiosago,https://www.radiosago.cl/12-establecimientos-escolares-municipales-de-osorno-iniciaran-su-ano-escolar-el-proximo-lunes/,12 establecimientos escolares municipales de Osorno iniciarán su año escolar el próximo lunes,"Así lo informó el Departamento de Administración de Educación Municipal, DAEM Osorno, confirmando que, según lo dispuesto por el Ministerio de Educación de manera oficial, las clases comienzan este miércoles 2 de marzo, independiente de la Fase del Plan Paso a Paso en que se encuentren las comunas del país. En tanto, los liceos Carmela Carvajal de Prat y de Rahue, y de las escuelas Juan Ricardo Sánchez, España, Canadá, Italia, las rurales de Pichil, Emilio Surber, Forrahue, Los Abedules y Santa Rosa y del Parvulario Pedro Aguirre Cerda, comenzarán su año escolar el lunes 7 de marzo. El director del DAEM Osorno, Mauricio Gutiérrez, explicó que estos establecimientos están terminando arreglos en infraestructura o a la espera de que se liciten recorridos de transporte escolar rural como razones para la medida excepcional. Gutiérrez afirmó que el uso de uniforme escolar no será obligatorio para este año, aunque sí comprarán algunos para quienes lo necesiten. En detalle, el ingreso de los establecimientos municipales de Osorno será el siguiente:  ",2022-03-01,
8,47327034.0,chile,radiosago,https://www.radiosago.cl/dejo-de-operar-recorrido-de-micro-en-ovejeria-seremi-dice-no-entender-las-razones-de-la-empresa/,Dejó de operar recorrido de micro en Ovejería: seremi dice no entender las razones de la empresa,"El único recorrido de microbuses urbanos que llegaba hasta el sector de Ovejería en Osorno dejó de funcionar esta jornada. Se trata de la variante 3B de la línea 3 de transporte urbano mayor de Osorno y que conectaba dicho sector con el centro y con el sector Chuyaca, llegando hasta la Universidad de Los Lagos. El operador, según informó a través de redes sociales, acusa incumplimientos de las autoridades, por lo que dejaron de administrar el recorrido, luego de tres meses de funcionamiento. Todo esto enmarcado en el Perímetro de Exclusión de la comuna que regula el transporte público y que está vigente desde noviembre del año pasado. El acuerdo era que ellos harían este recorrido que no fue adjudicado en un comienzo -al igual que el 7A que une Francke y el Hospital, operado por la Línea 7- mientras se agregaban al perímetro en un plazo de tres meses, y, luego, se quedarían con las rutas y recibirían un subsidio, adicional al de los otros recorridos que operan, por aquello. El seremi de Transportes, Nicolás Céspedes, explicó que, incluso, según la metodología, se asignó un monto mayor que el original que recibiría la Línea 9, servicio que no prosperó, lo que se suma a boletos cortados. Al cumplirse el plazo, el seremi indicó que no entiende el incumplimiento, pero que asumen que el operador quiere que se paguen los primeros tres meses en que funcionó el servicio. Desde Radio Sago intentamos tener la versión de la empresa operadora, agendando, y confirmando incluso, una entrevista con su representante legal para la mañana de este martes, la que no se realizó ya que no contestaron las llamadas. Por ahora, se espera que existan reuniones de acuerdo y, de no llegar a buen puerto, se deberá licitar el servicio que tiene a todo un sector de Osorno sin locomoción colectiva.",2022-03-01,
9,47327190.0,chile,radiosago,https://www.radiosago.cl/futura-delegada-provincial-de-osorno-senalo-que-espera-abrir-la-delegacion-a-la-ciudadania/,Futura delegada provincial de Osorno señaló que espera abrir la delegación a la ciudadanía,"Dentro de los nombramientos del presidente electo Gabriel Boric estuvieron las delegaciones presidenciales provinciales. En el caso de la provincia de Osorno también asumirá una mujer. Se trata de la ingeniera agrónoma, militante socialista y ex Consejera Nacional Indígena ante Conadi entre 2012 y 2014, Claudia Pailalef, que, a partir del 11 de marzo sucederá en el cargo a Mario Bello. Pailalef señaló que toma el desafío con humildad, además de destacar el compromiso de su partido con el nuevo gobierno. Sobre las labores que realizará desde los primeros días, Claudia Pailalef enfatizó que las demandas ciudadanas serán fundamentales y que la delegación tendrá las puertas abiertas para aquello.  Pailalef se convierte así en la primera mujer delegada presidencial provincial de Osorno, aunque es la segunda mujer en el cargo si se considera a las gobernaciones provinciales, tras la gestión de María Tabita Gutiérrez entre 2016 y 2018, cuando Michelle Bachelet cumplía su segundo mandato.",2022-03-01,
10,47318428.0,chile,radioacogida,https://radioacogida.cl/mas-de-6-mil-800-ninos-retornan-a-los-jardines-de-integra-en-la-region/,Más de 6 mil 800 niños retornan a los jardines de Integra en la región,"Las actividades se iniciaron este miércoles 2 de marzo, resguardando todas las medidas sanitarias, para garantizar la salud de los trabajadores, niños, niñas y sus familias. Autoridades dieron el vamos oficial al nuevo año parvulario en las renovadas dependencias del Jardín Infantil Los Pastorcitos de Correntoso. Con una visita a los niños y niñas y equipo del jardín infantil Los Pastorcitos, ubicado en el sector rural de Correntoso, la directora regional de Fundación Integra, Marcela Gallardo junto con la Seremi de Educación de Los Lagos, Paulina Lobos, dieron inicio oficial al año parvulario 2022. En la región de Los Lagos, existen 110 establecimientos de Fundación Integra, entre jardines infantiles, salas cuna y modalidades no convencionales, que atienden a más 6.800 niños y niñas. “Estamos felices de volver a recibir de manera presencial en nuestros establecimientos a todos los niños y niñas, ya que sabemos que la educación es fundamental en la primera infancia, especialmente entre los 0 y 4 años, donde la interacción, el lenguaje y la contención emocional requieren de un contacto directo. Se han realizado inversiones muy importantes para mejorar la infraestructura, además del aumento en material educativo y capacitación de los equipos para entregar educación de calidad”, destacó la directora regional de Integra.  Por su parte la seremi de Educación, señaló que “estamos muy contentos de estar dando inicio a este año parvulario en un jardín Integra en la comuna de Puerto Montt, vemos que ha habido un esfuerzo enorme del equipo regional y del mismo jardín infantil por brindar opciones de educación de calidad para los niños. Nuestra labor a través de la Subsecretaria de Educación Parvularia ha sido entregar los protocolos para el funcionamiento y lo que más destacamos de este año y que es tan importante para las familias es que se terminan los aforos en los establecimientos y eso significa que todos pueden acceder a la educación y las mamás y papás retornar a sus labores”. La directora de Integra destacó la importancia del trabajo con las familias para llevar adelante el proceso educativo de niños y niñas, reiterando la invitación para que se acerquen a los jardines infantiles y salas cuna, e inscriban a sus hijos e hijas para ser parte de los proyectos educativos.  “La institución realizó un estudio con la colaboración del Centro de Estudio de Primera Infancia (CEPI), para medir el impacto de estos dos años de atención interrumpida en el desarrollo de los niños y niñas, arrojando retrasos en las áreas de lenguaje y cognitivas. Las salas cuna y jardines infantiles son un espacio esencial de bienestar integral, contención, socialización, aprendizaje y encuentro para los niños, niñas y comunidades educativas; por eso esperamos que todos puedan asistir y que retomen sus rutinas para que aprendan jugando”, recalcó Gallardo. Los Pastorcitos Durante el año 2021, y gracias a una inversión de más de 148 millones de pesos, se llevaron a cabo obras de mejoramiento del jardín infantil Los Pastorcitos, con ampliación de espacios educativos y administrativos, y mejoras en áreas interiores y exteriores, además de reforzar aspectos de accesibilidad, permitiendo que hoy tenga renovadas instalaciones para recibir a sus 24 niños y niñas. Su directora, Carolina Rey, manifestó su alegría por contar con este flamante espacio para la comunidad del jardín que funciona desde 1994 en el sector rural. “Nuestro jardín realiza una labor muy importante para que niños y niñas de Correntoso reciban la mejor educación. En este sentido, el mejoramiento de nuestras dependencias nos motiva para seguir desarrollando iniciativas innovadoras para que nuestros niños y niñas tengan aprendizajes significativos para sus vidas”. En tanto, la apoderada del jardín, Isabel Valenzuela, dijo: “el año pasado por la pandemia decidí que él se quedara en la casa, pero como la pandemia se quedó con nosotros, decidí enviarlo ahora y estoy bien contenta con el jardín, porque es bonito, las tías son bien profesionales y preocupadas, hay una buena relación entre los apoderados y existe un grado de confianza donde uno sabe que los niños están bien acá y las tías tienen mucho cuidado con que se cumplan los protocolos”. Gracias a este proyecto de renovación, Los Pastorcitos podrá optar a la obtención del Reconocimiento Oficial, certificación entregada por el Ministerio de Educación y que indica que cumple con todos los estándares para entregar educación parvularia de calidad. En Los Lagos ya son 43 establecimientos de Integra los que cuentan con Reconocimiento Oficial. Integra pertenece a la Red de Fundaciones de la Presidencia de la República. Con 31 años de experiencia, es la red más grande de salas cuna y jardines infantiles del país con más de 1.200 establecimientos gratuitos, a los que asisten más 85 mil niños y niñas en todo Chile.",2022-03-07,
