,id_news,country,media_outlet,url,title,text,date,search
47,22598046.0,chile,seminariolocal,https://www.semanariolocal.cl/archivos/4555,Club Magallanes convertirá cada gol convertido en arboles nativos para el medio ambiente.,"‘La academia’ venció en condición de visita a Deportes Santa Cruz y lleva de momento seis goles en tres partidos disputados este 2022 manteniéndose firme en el inicio del torneo nacional y con su campaña contra el cambio climático. Club Magallanes cosecha un gran pasar en el Campeonato Ascenso, tras mantener puntaje perfecto en tres fechas disputadas, lo que lo posiciona en la primera posición de la tabla, pero no solo eso, la escuadra albiceleste busca desmarcarse y darle sentido a este buen pasar. Es por esto, que los seis goles que ha marcado se transformarán en árboles nativos certificados que ayudarán en la reforestación de los parques y bosques de nuestro país, gracias a la alianza que mantiene junto a la Corporación Cultiva. Vale recordar que, en el segundo semestre del 2021, Club Magallanes fue impulsor de esta iniciativa que lleva por nombre “1 gol = 1 árbol”, la que tuvo un resultado de 19 árboles que fueron donados en ayuda al medio ambiente. Junto con eso, quiso dar aún más visibilidad a su apuesta en la toma de conciencia y oficializó su camiseta alternativa, la cual es completamente verde, haciendo homenaje a los bosques nativos y al desarrollo sustentable, camiseta que hizo su debut ante Deportes Santa Cruz en la victoria como forastero por 1-2. Magallanes seguirá desarrollando durante el año iniciativas para concientizar a los hinchas del fútbol y mantener su compromiso con estos temas que los mueven.",2022-03-03,
48,22598049.0,chile,elllanquihue,https://www.ellanquihue.cl/impresa/2022/03/03/full/cuerpo-principal/10/,Gobierno extiende estado de Excepción en el norte hasta después del 11 de marzo,"La Moneda publicó la renovación del estado de Excepción por 15 días más en cuatro provincias fronterizas de la Macrozona Norte, debido a la crisis migratoria, porque, argumentó el Ejecutivo, ""a pesar de todos los esfuerzos desplegados, la situación en las zonas afectadas continúa"", con personas que entran en forma irregular al país caminando por el desierto, o mediante transporte ilegal. El 15 de febrero se dictaminó por primera vez esta medida de seguridad, la cual ayer fue renovada por otros 15 días, es decir, que seguirá vigente el 11 de marzo, cuando asuma el Presidente electo Gabriel Boric. La futura ministra del Interior, Izkia Siches -quien ayer no entregó su opinión al respecto-, señaló hace algunos días que analizaría la continuidad de la medida tras hablar con representantes locales. ""A pesar de todos los esfuerzos desplegados, la situación en las zonas afectadas continúa, subsistiendo las circunstancias que motivaron la declaración indicada en el considerando primero, y sin haber cesado éstas en forma absoluta, por lo que se hace necesario prorrogar la declaración de estado de excepción constitucional"", señala el texto publicado en el Diario Oficial. ""El control de las fronteras en materia migratoria y su protección contra el crimen organizado transnacional dedicado al tráfico de migrantes y la trata de personas es un problema que guarda relación tanto con la seguridad interna, como con la defensa nacional"", argumentó el Ejecutivo, ya que ""al desconocerse la identidad de las personas que ingresan clandestinamente, las policías no pueden ejercer adecuadamente el control migratorio y de orden público que les corresponde, lo que pone en riesgo la seguridad de la Nación"". Esta medida fue tomada luego de que un joven camionero falleciera tras caer de un paso bajo nivel en Antofagasta, donde tuvo un altercado con ciudadanos venezolanos que pedían ser trasladados en la carga del vehículo pesado, lo cual está prohibido. La política adoptada declara ""como zonas afectadas las provincias de Arica y Parinacota, en la Región de Arica y Parinacota, excluyendo el radio urbano de la ciudad de Arica; la provincia del Tamarugal, en la Región de Tarapacá; y la provincia de El Loa, en la Región de Antofagasta, excluyendo el radio urbano de la ciudad de Calama"". Además, se renueva por ""el mismo período, las designaciones de los jefes de la Defensa Nacional en las zonas señaladas en el artículo anterior, y a los miembros de las Fuerzas Armadas"" en el lugar. El ministro del Interior, Rodrigo Delgado, escribió en Twitter que ""estamos utilizando todas las herramientas que permite la ley para dar seguridad en nuestras fronteras. (...) Los chilenos merecen vivir tranquilos"". El estado de Excepción también se mantiene vigente en la Macrozona Sur, debido a los hechos de violencia en Biobío y La Araucanía.",2022-03-03,
49,22598050.0,chile,elllanquihue,https://www.ellanquihue.cl/impresa/2022/03/03/full/cuerpo-principal/11/,"Presidente abrió el año escolar: ""La escuela es un lugar seguro""","El Presidente Sebastián Piñera inauguró oficialmente ayer el año escolar 2022: junto al ministro de Educación, Raúl Figueroa, concurrió al Liceo Bicentenario Santa María de Paine, en la capital, donde destacó el regreso de las clases presenciales tras dos años de la pandemia que obligó por largo tiempo a mantener a los escolares lejos de las aulas y luego a mantener la voluntariedad para las actividades en los colegios. ""Hoy día 3,5 millones de niños y jóvenes van a tener el privilegio que todos recordamos con tanta nostalgia en las salas de clases, en los pasillos, en los patios, entre abrazos y expresiones de alegría se van a reencontrar con profesores, amigos y compañeros, y tener la vida que queremos tener"", expresó el Mandatario. El Jefe de Estado recalcó que ""la escuela no sólo se convierte en el segundo hogar, sino que, para muchos padres, la escuela es una aliada en la formación y educación de sus hijos"". Piñera destacó la importancia de las clases presenciales porque ""la educación a distancia nunca reemplaza o equivale a la educación presencial. No sólo cayó la calidad de la educación, sino que se ampliaron las brechas entre quienes tenían acceso a la educación digital o a distancia y los que no la tenían o la tenían con muchas restricciones"". ""La escuela es un lugar seguro y hemos tomado todas las precauciones y todos los protocolos para que la escuela sea un lugar seguro. Obviamente que no hay ningún lugar 100 por ciento seguro en el mundo, pero la escuela es uno de los lugares más seguros que tienen la inmensa mayoría de nuestros niños"", sentenció el Presidente. El Ministerio de Educación entregó a todos los recintos educativos del país un protocolo de medidas sanitarias. Debido al alto nivel de vacunación alcanzado en los estudiantes, pues prácticamente el 90% de los escolares ya cuentan con su esquema de vacunación completo, se eliminaron las restricciones de aforo en todos los espacios dentro de los establecimientos educacionales. El protocolo también destaca la ventilación permanente de las salas de clases y espacios comunes, el uso de mascarillas de acuerdo a las recomendaciones de la Organización Mundial de la Salud (OMS), implementar rutinas de lavado de manos cada 2 ó 3 horas, eliminar los saludos que requieran contacto físico y establece una serie de recomendaciones para los apoderados y comunidad educativa en general, en diferentes ámbitos del día a día. El Presidente electo, Gabriel Boric, también saludó el regreso a clases e incluyó en su mensaje a educadores y estudiantes. ""Un abrazo a las comunidades educativas que se reencontrarán en las aulas, fruto del diálogo de todas las partes. Impulsaremos este trabajo que asegure el derecho a la educación. Compartir con pares es fundamental en el desarrollo de las y los estudiantes"", escribió en sus redes sociales. El futuro ministro de Educación, Marco Antonio Ávila, expresó que ""apoyaremos a todo el sistema educativo con flexibilidad y diálogo"".",2022-03-03,
50,22598051.0,chile,elllanquihue,https://www.ellanquihue.cl/impresa/2022/03/03/full/cuerpo-principal/12/,Casi 2.000 civiles han muerto mientras continúa ataque a ciudades ucranianas,"Los civiles ucranianos han pagado un alto precio en la primera semana de guerra, mientras Rusia continúa avanzando en el este y el sur del país, donde intenta tender un corredor terrestre entre el Donbás y la anexionada península de Crimea. ""El nazismo nace del silencio. Por eso hay que gritar sobre el asesinato de civiles, sobre el asesinato de los ucranianos"", aseguró el presidente de Ucrania, Volodímir Zelenski. Como resultado, en los siete días de conflicto habrían muerto más de 2.000 civiles ucranianos, según el Servicio Estatal de Emergencia. ""Durante los siete días de la guerra, Rusia ha destruido cientos de infraestructuras de transporte, viviendas, hospitales y guarderías. En este tiempo han muerto más de 2.000 ucranianos, sin contar a nuestros defensores"", señala el comunicado oficial. Entre ellos, han fallecido 21 niños y 55 han resultado heridos, según Liudmila Denísova, Defensora del Pueblo, quien abogó por crear una zona de exclusión aérea sobre Ucrania al considerar que salvaría muchas vidas. ""Las Fuerzas Armadas de Rusia continúan violando los derechos básicos de los niños"", denunció. Por primera vez en siete días de ofensiva militar, Rusia admitió la muerte de 498 soldados en la guerra, además de 1.597 militares heridos, según el vocero del Ministerio de Defensa, Igor Konashénkov. En contraste, la viceministra ucraniana de Defensa, Hanna Malyar, dijo que, según datos preliminares de Kiev, hasta el momento han muerto 5.840 soldados rusos. Según Rusia, las bajas entre las fuerzas ucranianas ascienden a 2.870 fallecidos y los heridos 3.700. El Ejército ruso avanzó con intensos ataques en el sur de Ucrania, donde tomó el control de Jersón y donde prácticamente bloquea ya Mariúpol, así como en el este, donde asegura haberse apoderado en buena medida de la costa del mar de Azov. ""Las divisiones rusas de las fuerzas armadas tomaron la ciudad de Jersón bajo control total"", afirmó el portavoz del Ministerio de Defensa, Ígor Konashénkov. Más al este, en Mariúpol, a orillas del mar de Azov y en la región de Donetsk, los separatistas prorrusos apoyados por el poderío militar ruso aseguraron que sus fuerzas habían bloqueado la ciudad, según los medios rusos. ""Mariúpol está bloqueada por hoy. Las tropas seguirán moviéndose en esa dirección para finalmente detener el bombardeo de áreas residenciales"", dijo el representante de la milicia de Donetsk, Eduard Basúrin, en la televisión pública rusa Rossía-24. Sin embargo, el Ministerio del Interior ucraniano aseguró que ""las batallas por Mariúpol continúan"", ya que las unidades de la Guardia Nacional junto con las Fuerzas Armadas ""mantienen la defensa de la ciudad"". El avance de un convoy militar ruso hacia Kiev quedó estancado entre las últimas 24 y 36 horas por la resistencia ucraniana y porque los rusos se estarían reagrupando y evaluando el progreso que no han logrado, dijo este miércoles el Pentágono. El vocero del Departamento de Defensa de Estados Unidos John Kirby, aseguró en una rueda de prensa que otro de los motivos del estancamiento de esa caravana castrense son ""desafíos logísticos y de mantenimiento"", que los rusos no habían anticipado. El Gobierno de Ucrania está ""plenamente operativo"" pese a la gran ofensiva militar rusa, aseguró hoy la viceministra ucraniana de Exteriores, Emin Zaparova, en una intervención por teleconferencia ante el Consejo de Derechos Humanos de la ONU, que se reúne en Ginebra. Este jueves habrá otra mesa de negociación en territorio bielorruso, pero en esta ocasión en Belovézhskaya Puscha, en la región de Brest, más cerca de Polonia. ""Tengo entendido que vienen desde Polonia"", señaló el jefe negociador ruso, Vladímir Medinski. La Oficina del Presidente de Ucrania confirmó poco después que la delegación ucraniana viajará a Belovézhskaya Puscha. 5.840 soldados rusos han muerto desde el inicio de la invasión, según informó el Gobierno de Ucrania. 498 soldados son las bjas rusas, desde el inicio de la invasión, según informó el Kremlin. En medio de temores por posibles incidentes radiactivos a causa de la invasión rusa, Ucrania ha pedido al OIEA ""ayuda inmediata"" para garantizar la seguridad de sus instalaciones nucleares, que en ningún caso tienen fines militares, destacó la agencia atómica de la ONU. El director general del Organismo Internacional de la Energía Atómica, Rafael Grossi, explicó en Viena que sus expertos están analizando qué tipo de ayuda pueden brindar. ""Puede ser el envío de expertos, pero también puede ser asistencia telemática desde aquí (la sede del OIEA)"", señaló el director general en una rueda de prensa.",2022-03-03,
51,22598052.0,chile,elllanquihue,https://www.ellanquihue.cl/impresa/2022/03/03/full/cuerpo-principal/12/,OMS pide corredor humanitario para facilitar material sanitario a Ucrania,"La Organización Mundial de la Salud reiteró la ""urgente necesidad"" de establecer un corredor seguro para facilitar la llegada de material sanitario a Ucrania y mostró su preocupación por la crisis humanitaria surgida a raíz del conflicto bélico con Rusia. El director general de este organismo, Tedros Adhanom Ghebreyesus, señaló en una conferencia de prensa virtual que el primer envío con material sanitario, transportado desde Dubái, llegará este jueves a Polonia con material médico especializado que podría cubrir las necesidades de alrededor de 150.000 personas. Adhamom señaló que habrá más envíos en los próximos días y que ya se habían retirado 5,2 millones de dólares del fondo de emergencias de la OMS, pero que serán necesarios otros 45 millones para los próximos tres meses. ""Hay cierto acceso a material, pero dada la evolución del conflicto, tememos un empeoramiento de la situación"", dijo el director de OMS-Ucrania, Jarno Habicht. Habicht lamentó la imposibilidad de poder distribuir material sanitario guardado en los almacenes de la OMS en Kiev y centró las preocupaciones en la falta de oxígeno y de medicinas y en los problemas para llevar a cabo la campaña de vacunación contra la polio. REFUGIADOS La Agencia de Naciones Unidas para los Refugiados (ACNUR) ha elevado a 874.000 el número de ucranianos que han huido de la guerra que se inició hace una semana, tras la invasión y los ataques lanzados por Rusia desde varios frentes. Esta actualización corresponde a datos recogidos en los países vecinos de Ucrania, precisó la entidad. Otras 96.000 personas han cruzado desde las regiones orientales de Lugask y Donestk -bajo control de grupos armados separatistas desde 2014- hacia Rusia. El papa Francisco ha donado material médico para que se envíe en los próximos días a Ucrania para ayudar a una población que está sufriendo la invasión de Rusia, informó el responsable de la limosnería vaticana, el cardenal polaco Konrad Krajewski. El envío incluye jeringas, tiritas, desinfectantes, entre otros. 874.000 ciudadanos ucranianos han abandonado el país desde el inico de la invasión rusa, según informó Acnur.",2022-03-03,
52,22598053.0,chile,elllanquihue,https://www.ellanquihue.cl/impresa/2022/03/03/full/cuerpo-principal/13/,ONU condena invasión y Rusia amenaza con guerra nuclear,"Con una abrumadora mayoría, la Asamblea General de Naciones Unidas aprobó una resolución de condena a la invasión de Ucrania y exigió a Rusia la retirada inmediata de sus tropas. De los 193 Estados miembros de la ONU, 141 respaldaron el texto, mientras que únicamente cinco votaron en contra: la propia Rusia, Bielorrusia, Siria, Corea del Norte y Eritrea. Mientras tanto, 35 países optaron por la abstención, entre ellos China, Irán, India, Sudáfrica y varias naciones latinoamericanas como Cuba, Bolivia, El Salvador y Nicaragua. La resolución, que no tiene carácter vinculante, ""deplora"" la agresión rusa contra Ucrania y ""demanda"" a Moscú que le ponga fin y retire inmediatamente y sin condiciones sus tropas del país vecino. Además, critica el papel de Bielorrusia en la guerra y exige a Rusia que dé marcha atrás a su reconocimiento de la independencia de las autodeclaradas repúblicas separatistas ucranianas. Para el Secretario General de la ONU, António Guterres, la Asamblea General ha enviado un mensaje ""alto y claro"" sobre la necesidad de detener las hostilidades y apostar por la diplomacia. ""Voy a seguir haciendo todo lo que esté en mi mano para contribuir a un cese inmediato de las hostilidades y a negociaciones urgentes de paz. La gente en Ucrania necesita paz desesperadamente y la gente de todo el mundo lo demanda"", señaló Guterres a los periodistas. ""Hemos demostrado que Rusia está aislada y sola y que el coste seguirá subiendo hasta que Rusia ceda"", celebró tras la votación la embajadora estadounidense ante la ONU, Linda Thomas-Greenfield. La delegación rusa agradeció que la cuarta parte de los miembros de la organización no apoyasen la resolución ""a pesar de una presión increíble y sin precedentes por parte de EE.UU. y sus aliados"". Para Moscú, el texto sólo servirá para envalentonar a los ""radicales"" ucranianos, a quienes los representantes acusaron de ser los responsables del conflicto y de estar usando a civiles como escudos humanos. La Unión Europea celebró la ""derrota moral y diplomática"" para Rusia que supone que la Asamblea General de Naciones Unidas haya rechazado ""abrumadoramente"" la invasión a Ucrania. ""Es una gran derrota moral y diplomática para Rusia. Los llamamientos al Kremlin para que retire inmediatamente todas las fuerzas de Ucrania no pueden sonar más fuertes que esto. El derecho internacional debe prevalecer y prevalecerá"", publicó en su cuenta de Twitter el presidente del Consejo Europeo, Charles Michel. El alto representante para la Política Exterior de la UE, Josep Borrell, celebró el rechazo de forma ""abrumadora"" de la agresión y también el hecho de que ""el mundo permanece unido en la defensa de las leyes y los principios en los que se basan la paz y la seguridad internacionales"". En ese mismo sentido, el presidente estadounidense, Joe Biden, prometió que hará ""pagar un precio"" por la invasión de Ucrania a su homólogo ruso Vladímir Putin, y que conseguirá ""salvar la democracia"" de los retos que enfrenta dentro y fuera de Estados Unidos. La guerra en Ucrania centró parte del primer discurso de Biden sobre el estado de la Unión, en el que anunció su decisión de cerrar el espacio aéreo de Estados Unidos a las aerolíneas rusas, como han hecho Canadá y la Unión Europea. ""Putin está más aislado que nunca del resto del mundo"", proclamó el mandatario ante los legisladores de ambas cámaras del Congreso estadounidense. El ministro de Exteriores de Rusia, Serguei Lavrov, aseguró que el presidente estadounidense, Joe Biden, sabe que la única alternativa a las sanciones contra Rusia es una Tercera Guerra Mundial y que sería ""una guerra nuclear devastadora"", en declaraciones a la cadena de noticias Al Jazeera. Dijo también que su país estaba ""listo"" para afrontar las sanciones impuestas por EE. UU. y la UE por el ataque a Ucrania, pero que no esperaba que apuntaran a atletas, intelectuales, artistas y periodistas.",2022-03-03,
53,22598062.0,chile,laestrelladechiloe,https://www.laestrellachiloe.cl/impresa/2022/03/05/full/cuerpo-principal/12/,"""No sentimos presión. Lo más importante es volver a jugar bien""","Gustavo Quinteros buscará incrementar la supremacía de Colo Colo en el Estadio Monumental ante la Universidad de Chile en el Superclásico del fútbol chileno mañana a las 12 horas en Macul. El entrenador albo habló sobre el trascendental duelo, el nivel de sus jugadores y la presión que significa jugar este importante partido. Tanto albos como azules llegan con derrotas al partido más importante para ambos en el torneo. Colo Colo acumula tres partidos sin conocer el triunfo y Quinteros asume las críticas por lo mostrado dentro de la cancha, pero sabe que, con confianza y trabajo, el plantel podrá salir adelante. ""Hay que darles confianza a los jugadores, entregarle las herramientas para mejorar y que así regresen al nivel futbolístico que tenían. Si ganas dos partidos seguidos puedes volver a la parte alta, hay que mantener tranquilidad para retomar el mejor nivel"", comentó el estratega en el Estadio Monumental en la previa del Superclásico. Son 21 los años en que la Universidad de Chile no conoce de triunfos en la cancha alba, y según el entrenador de Colo Colo, no existe presión ante una posible derrota histórica frente a su clásico rival histórico. ""No sentimos presión, lo más importante es volver al nivel futbolístico y seguir adelante pensando en el objetivo de ser campeón. Hemos entrenado sistemas y creo que hay variantes para utilizar"", sostuvo. ""El fútbol es hoy, es ahora. Tenemos que pensar en que tendremos un rival fuerte al frente y tenemos que mejorar muchas cosas de los partidos anteriores"", agregó el entrenador. Quinteros también confirmó que Óscar Opazo está en condiciones para el partido de mañana y que ha entrenado con normalidad, mientras que Joan Cruz no estará disponible. Además, se refirió al rol que jugará Leonardo Gil en el encuentro, quien jugará como volante creativo ante los azules. ""La mejor virtud que tiene Gil es el pase filtrado y dejar mano a mano a los delanteros. Queremos aprovechar eso. Está acostumbrado a jugar un poco más adelantado, pero lo hace bien en ambas posiciones"", enfatizó Quinteros. De esta forma, el Cacique saldría a la cancha del Estadio Monumental con Brayan Cortés en el arco; Oscar Opazo, Maximiliano Falcón, Emiliano Amor y Gabriel Suazo en defensa; César Fuentes, Esteban Pavez y Leonardo Gil en el mediocampo; Pablo Solari, Gabriel Costa y Juan Martín Lucero en el ataque. ""Tenemos que pensar en que tendremos un rival fuerte al frente. Hay que mejorar muchas cosas de los partidos anteriores"".",2022-03-05,
54,22598063.0,chile,laestrelladechiloe,https://www.laestrellachiloe.cl/impresa/2022/03/05/full/cuerpo-principal/14/,La obesidad dispara los casos de trastornos mentales,"Ocho de cada diez mexicanos con obesidad sufren de algún tipo de trastorno mental que se ha agudizado por los efectos sociales de la pandemia de la covid-19, aseguró el doctor Luis Meixueiro Torres, especialista en psiquiatría por el Instituto Nacional de Psiquiatría Ramón de la Fuente Muñiz. Con motivo del Día Mundial de la Obesidad, que se conmemora cada 4 de marzo por iniciativa de la Federación Mundial de la Obesidad, el doctor Luis Meixueiro explicó a EFE que debido al confinamiento por la pandemia habrá más personas con obesidad y con trastornos mentales. Según la Encuesta Nacional de Salud y Nutrición, el 74,1% de la población adulta y 38,2% de la población infantil tienen en México sobrepeso u obesidad, cifras que irán en aumento durante los próximos años, ya que el 34 % de los mexicanos ha subido de peso durante la pandemia. El estudio de Ipsos titulado ""Las implicaciones del covid-19 en nuestra dieta y salud"" reveló que los mexicanos aumentaron su peso durante la pandemia un promedio de 8,5 kilos por persona, la cifra más alta comparada con otros países. ""Durante el confinamiento ha habido un exceso en el consumo de carbohidratos y además la ansiedad disparó las cifras de sobrepeso"", indicó Meixueiro.",2022-03-05,
