,id_news,country,media_outlet,url,title,text,date,search
95,47554346.0,chile,elheraldoaustral,https://www.eha.cl/noticia/regional/ultimos-dias-para-que-organizaciones-laborales-de-la-region-postulen-al-programa-de-senda-trabajar-con-calidad-de-vida-2022-13475,Últimos días para que organizaciones laborales de la región postulen al programa de SENDA “Trabajar con Calidad de Vida” 2022,"La iniciativa contribuye a mejorar la calidad de vida laboral y las organizaciones laborales interesadas pueden postular hasta este viernes 04 de marzo a través de la página https://www.senda.gob.cl La iniciativa contribuye a mejorar la calidad de vida laboral y las organizaciones laborales interesadas pueden postular hasta este viernes 04 de marzo a través de la página https://www.senda.gob.cl Ya está disponible un banner de acceso directo desde la página principal de SENDA, para postular al programa “Trabajar con Calidad de Vida” 2022, el que tiene por objetivo prevenir el consumo de alcohol y otras drogas al interior de las organizaciones laborales, contribuyendo a mejorar la calidad de vida de sus trabajadores y trabajadoras, además de desarrollar una cultura preventiva. El  director regional (s) de SENDA Los Lagos,  Leonardo Cataldo, señaló que “invitamos a las organizaciones laborales de la región a postular al programa Trabajar con Calidad de Vida, iniciativa que tiene por objetivo desarrollar una cultura preventiva que contribuya al bienestar de los trabajadores y trabajadoras,  para fortalecer ambientes laborales promotores de redes de cuidado y protección frente al consumo de alcohol y otras drogas”. A esta iniciativa pueden postular instituciones públicas que no hayan implementado el Programa Trabajar con Calidad de Vida, y que no cuenten con un programa de prevención vigente o que deseen renovarlo. Además, de empresas privadas legalmente constituidas en Chile con 50 o más trabajadores, que no cuenten con un programa de prevención vigente (que incluya una política preventiva y un plan de acción) o que deseen renovarlo. Finalmente, es importante dar a conocer que de acuerdo a las evaluaciones realizadas referente a este programa, se puede considerar que aquellos trabajadores que participaron de las actividades asociadas al Programa Trabajar con Calidad de Vida, tendrían menos riesgos de necesitar una intervención asociada al consumo de alcohol, en comparación con aquellos trabajadores antes de que se implementara el programa en sus organizaciones. Para mayor información y acceder a formulario de postulación pueden visitar la página https://www.senda.gob.cl/prevencion/iniciativas/prevencion-en-espacios-laborales/trabajar-con-calidad-de-vida/ ",2022-03-02,
96,47554356.0,chile,elheraldoaustral,https://www.eha.cl/noticia/regional/tasa-de-desocupacion-en-la-region-de-los-lagos-alcanzo-un-3-13469,Tasa de desocupación en la región de Los Lagos alcanzó un 3%,"El Instituto Nacional de Estadísticas (INE) informó el día de hoy los resultados de la última Encuesta Nacional de Empleo correspondientes al trimestre móvil noviembre, diciembre 2021 y enero 2022. La región de Los Lagos se sitúa con una tasa de desempleo de un 3,0% lo que registra una disminución de 0,7 puntos porcentuales respecto a igual trimestre del período anterior. La tasa de desocupación nacional fue de un 7,3%. La tasa de desocupación regional fue un 3%, debido a que la fuerza de trabajo disminuyó anualmente (-1,1%) en mayor proporción con los ocupados (-0,4%). Por su parte, los desocupados disminuyeron un 20,4%. Respecto a los resultados de la encuesta, el seremi de Economía, Fomento y Turismo, Francisco Muñoz, expresó que “el 3% de la tasa de desocupación del trimestre móvil noviembre, diciembre y enero muestra señales de consolidación de la recuperación del empleo en la región de Los Lagos considerando una temporada estival la cual el turismo, la agricultura y la ganadería se reactivan con mucho vigor en este período” añadió que “nuestro Gobierno dispuso de instrumentos como el Bono de Alivio a las Pymes, que alcanzó 88 mil millones de pesos en la región, más bonos a emprendimiento 6.700 millones de peso y también la medida del IFE Laboral que actualmente tiene una cobertura de 39 mil trabajadores y ya se anunció la extensión por tres meses más. Esto ha permitido que en la región de Los Lagos recuperemos 26 mil puestos laborales desde el período más desfavorable de la pandemia correspondientes a los meses de mayo, junio y julio de 2020”. Además dijo que “hemos visualizado que nuevos ámbitos productivos se han consolidado en la recuperación del empleo como la construcción que aumentó un 56% su fuerza laboral y también otras actividades profesionales científicas y técnicas aumentando un 52%”. Por su parte, el seremi del Trabajo y Previsión Social, Fernando Gebhard, manifestó que “la cifra del 3% de desocupación regional refirma las señales positivas en el mercado laboral. En tanto, la tasa de participación alcanzó 46,2%, disminuyendo 1,0 punto porcentual en doce meses, y los ocupados disminuyeron 0,4% en doce meses, lo que equivale a 1.272 personas. Por este motivo que herramientas como el IFE Laboral que se amplió al 31 de junio siguen tomando gran relevancia en la reactivación económica y del mercado laboral”.  ",2022-03-01,
97,47554377.0,chile,elheraldoaustral,https://www.eha.cl/noticia/regional/monitoreo-con-camaras-trampa-amplia-informacion-sobre-presencia-y-comportamiento-de-especies-en-parques-nacionales-de-la-region-de-los-lagos-13467,Monitoreo con cámaras trampa amplía información sobre presencia y comportamiento de especies en parques nacionales de la Región de Los Lagos,"A partir de las primeras campañas de instalación en distintos parques nacionales, estos dispositivos han permitido obtener información sobre la presencia de diversas especies, su comportamiento y la existencia de amenazas en áreas silvestres protegidas de la región de Los Lagos. A partir de las primeras campañas de instalación en distintos parques nacionales, estos dispositivos han permitido obtener información sobre la presencia de diversas especies, su comportamiento y la existencia de amenazas en áreas silvestres protegidas de la región de Los Lagos. Registros de pudú, pumas, así como también de especies exóticas que amenazan la conservación es lo que se ha obtenido a partir de la serie de campañas de instalación de cámaras trampa para monitoreo de fauna en los en diversos puntos de las áreas silvestres protegidas de la región, entre ellos, los parques nacionales Chiloé, Vicente Pérez Rosales y Pumalín Douglas Tompkins, lo que se extenderá a otras unidades de la región con el objetivo de registrar, monitorear, sistematizar información y planificar medidas para fortalecer la conservación. Las cámaras trampa son instaladas en lugares estratégicos por guardaparques de CONAF, con la finalidad de registrar y estudiar de manera no invasiva las dinámicas e interacciones en cada unidad. Es así como a partir de este trabajo, en el Parque Nacional Vicente Pérez Rosales se ha podido observar la presencia  de güiñas, monitos del monte, zorros, chingues, en un mismo sector del Parque Nacional, así como también pumas y pudúes con sus crías. Esta información resulta clave para diversos objetivos de conservación, así como también para avanzar en el proceso de incorporación de este Parque Nacional al estándar internacional de gestión de áreas protegidas Lista Verde, de la Unión Internacional para la Conservación de la Naturaleza (UICN). Por su parte, en el Parque Nacional Chiloé, a partir de la información levantada se ha obtenido información y registros de chucao, pudú, zorro chilote, güiñas moteadas y melánicas, quique y monito del monte. Dicho parque nacional tendrá dos campañas de instalación de cámaras durante 2022, con un total de 60 equipos monitoreando. “Este es un trabajo colaborativo y en cada campaña participan de manera integrada guardaparques de varios parques nacionales de la región con el objetivo de aprender y compartir aprendizajes en el monitoreo de especies, manejo de cámaras trampa, uso de GPS y análisis de datos”, explica Jorge Aichele, director regional de CONAF Los Lagos. “Además de la presencia de fauna nativa, el monitoreo nos permite identificar amenazas, como el ingreso de perros, ganado o personas a las áreas silvestres protegidas, pudiendo actuar, tomar decisiones y fortalecer las estrategias de conservación que se llevan a cabo desde los equipos de CONAF”, agregó. El trabajo de monitoreo en áreas silvestres protegidas en la región se enmarca en una estrategia nacional que evalúa las prácticas de conservación y control de amenazas dentro de un ciclo de manejo adaptativo, además de informar acerca del estado de las especies y sus ecosistemas.  ",2022-03-01,
98,47554380.0,chile,elheraldoaustral,https://www.eha.cl/noticia/regional/presidente-electo-gabriel-boric-nombro-como-delegada-presidencial-para-la-region-de-los-lagos-a-giovanna-moreira-almonacid-13464,Presidente electo Gabriel Boric nombró como Delegada Presidencial para la región de Los Lagos a Giovanna Moreira Almonacid,"El Presidente Electo Gabriel Boric, nombró como Delegada Presidencial para la región de Los Lagos a Giovanna Moreira Almonacid, quien es Administradora Pública y Licenciada en Ciencias Políticas con más de diez años de experiencia, liderando como Directora Regional de la Fundación TECHO-Chile por 4 años a equipos e iniciativas en contextos de vulnerabilidad, exclusión social, pobreza y desigualdad socio-territorial. Ha cursado diplomados en perspectiva de género para la planificación de las ciudades y los territorios. Es Presidenta Regional del Partido Liberal y fue candidata a Constituyente por el Distrito 25.",2022-03-01,
99,47559295.0,chile,radiosago,https://www.radiosago.cl/sernapesca-otorga-convenio-de-uso-a-pescadores-de-caleta-anahuac-en-puerto-montt/,Sernapesca otorga Convenio de Uso a pescadores de caleta Anahuac en Puerto Montt,"A través de una ceremonia el Servicio Nacional de Pesca y Acuicultura hizo entrega, mediante un convenio de uso, de la Asignación de la Destinación Marítima al Sindicato de Trabajadores Independientes Pescadores Artesanales, Cultivadores de Recursos del Mar de Anahuac en el marco de la denominada Ley de Caletas. Con un total de 74 socios, el Sindicato de esta caleta podrá administrar su territoriopor 30 años ejerciendo además de acciones propias de la pesca, nuevas actividades, tales como turismo pesquero, gastronomía, talleres, etc. Incorporando a la comunidad y apoyando a la gestión pesquera, además de dar valor agregado a la Caleta. El Director Nacional de Sernapesca, Claudio Báez Beltrán, destacó el camino recorrido por los pescadores artesanales, además de agradecer a todas las instituciones que contribuyeron a lo que calificó como un gran paso.  Juan García, Presidente del Sindicato de Pescadores Artesanales de Anahuac calificó como un hito la firma de dicho convenio porque permitirá la mejor administración de la caleta.  La Subsecretaria de Pesca y Acuicultura. Alicia Gallardo,  valoró el esfuerzo para acercar la caleta a la ciudadanía, sobre todo en la época de pandemia.  Con el plan de administración aprobado, la caleta Anahuac tomará otro rumbo, diversificando su actividad, ya que se informó que no solo será un lugar donde únicamente desembarquen la pesca, sino que también un espacio productivo, social y cultural.",2022-03-05,
100,47559365.0,chile,radiosago,https://www.radiosago.cl/campeonato-de-ascenso-ante-deportes-melipilla-jugara-hoy-deportes-puerto-montt/,Campeonato de Ascenso: Ante deportes Melipilla jugará hoy Deportes Puerto Montt,"De visita jugará esta tarde Deportes Puerto Montt, en el marco de una nueva fecha del campeonato del fútbol de ascenso 2022. El cuadro sureño enfrentará a “Deportes Melipilla”, a contar de las  18:00 horas en “la Pintana”. En entrevista con Radio “Sago”, el Capitán de los “Delfines”, Diego Opazo, dijo que el cuadro sureño dejó atrás el primer partido del campeonato, el que se perdió por 2 goles a cero ante “Magallanes”. Igualmente, indicó que el plantel llegará de mejor manera al partido de hoy ante “Melipilla”, tras la suspensión del encuentro por la segunda fecha. Diego Opazo añadió que el Director Técnico, Erwin Durán, ha preparado una buena estrategia para el partido de esta tarde ante “Deportes Melipilla”. Jugadas 2 fechas del Campeonato Ascenso Betsson, Deportes Melipilla marcha último en la tabla de posiciones, con cero puntos y 3 goles en contra. Puerto Montt, por su parte, tampoco suma puntos, pero tiene 2 goles en contra y se ubica en el puesto 15 de la tabla de posiciones. El partido entre ambas escuadras está programado para las 18 horas y se disputará en el estadio “Roberto Bravo” de la comuna de “La Pintana”, en la Región Metropolitana. El encuentro será transmitido por “La Onda Deportiva” de Radio “Sago” en la ciudad de Puerto Montt y en www.radiosago.cl",2022-03-02,
101,47353651.0,chile,elheraldoaustral,https://www.eha.cl/noticia/local/jaurias-ponen-en-riesgo-al-ganado-y-fauna-silvestre-de-la-zona-13514,Jaurías ponen en riesgo al ganado y Fauna silvestre de la zona,"Agrollanquihue ha venido trabajando hace ya algunos meses en la campaña “No botes tu perro” para hacer conciencia en los propietarios de estos animales en no abandonarlos. Agrollanquihue ha venido trabajando hace ya algunos meses en la campaña “No botes tu perro” para hacer conciencia en los propietarios de estos animales en no abandonarlos. Los ataques de perros asilvestrado ya no son un evento aislado, sino que se ha vuelto recurrente especialmente en los últimos meses; lo que no sólo ha causado daño a personas, sino que también al ganado de los predios y a la fauna silvestre de la zona. Eduardo Schwerter, presidente de Agrollanquihue A. G. indicó que los ataques al ganado por parte de perros asilvestrados son muy difíciles de  sorprender ya que los agricultores muchas veces encuentran a sus animales muertos o gravemente heridos y maltratados. “Para erradicar este difícil problema hay que comenzar por educar en la tenencia responsable de las mascotas, ya que muchos de los perros asilvestrados fueron mascotas con dueños que los abandonaron; y es ahí donde su instinto animal busca alimentos en los campos, siendo el ganado y la fauna silvestre una presa fácil. Schwerter dijo además que estas jaurías además de atacar al ganado productivo también afectan a la fauna local como pudúes, zorros, liebres, aves y otras especies silvestres que son parte del ecosistema que hay en el sector rural de la región. Cada ataque de perros causa graves daños económicos a la agricultura pudiendo llegar a ser peor que los daños que produce el abigeato. Helmuth Bollinger, uno de los agricultores recién afectados de la zona de Salto Grande, en Puerto Montt, ha tenido 41 animales heridos en esta temporada, y el 60% ha muerto, el resto se ha logrado recuperar con antibiótico. “Hay perros que se vuelven silvestre y forman jaurías y que por su instinto matan animales para alimentarse. La ley de tenencia responsable no se cumple, porque si todos cuidáramos nuestros perros esto no pasaría. Además, los perros los corretean y los animales desesperados para arrancar rompen los cercos, se hieren, además quedan mordidos.  La última vez murieron seis vaquillas en un solo ataque”, indicó el agricultor. Es así como el gremio agrícola ha dispuesto una serie de acciones para seguir concientizando a la población de la gravedad de abandonar a los perros y del daño que pueden causar. El presidente de Agrollanquihue hizo un llamado a la autoridad a seguir trabajando para evitar los ataques de los perros asilvestrados en zonas rurales. ",2022-03-05,
102,47353975.0,chile,elheraldoaustral,https://www.eha.cl/noticia/local/mosaicos-de-escalera-ricke-comienzan-su-proceso-de-reconstruccion-13509,Mosaicos de escalera Ricke comienzan su proceso de reconstrucción,"El pasado martes 1 de marzo, comenzaron los trabajos de reconstrucción de los mosaicos de la Escalera Ricke, luego de polémico incidente con contratistas de Essal el pasado 15 de noviembre “Es un trabajo que toma tiempo”, destacó Carolina Cruz, DIrectora General del Carnaval del Sur, sobre el trabajo que están realizando con los mosaiquistas locales, en la visitada escalera Ricke, la cual se vio afectada por los trabajos realizados por el rompimiento de una matriz de aguas servidas. Cabe destacar que fue el mismo Director de Obras municipal, Ricardo Matamala, quién detuvo la obra de la empresa, el pasado mes de noviembre, ya que no habían notificado al municipio del trabajo a realizar en el importante espacio de la ciudad, lo cual causó sorpresa y extrañeza en la comunidad puertovarina Luego del incidente la empresa se comprometió a reponer de manera íntegra los tramos de mosaicos que se vieran afectados y colaborar con el Carnaval del Sur en la reconstrucción de la importante obra de cerámica, trabajos que comenzaron este martes 1 de marzo. Carolina Cruz, Directora General del Carnaval del Sur, se refirió al proceso de trabajo que significa rehacer los mosaicos de el pasaje Ricke. “Estamos trabajando desde diciembre en este proyecto de reposición. Lo que se hizo en años, no se puede rehacer en un mes o dos, lo primero que se hizo fue ver el estado del lugar, con dos empresas contratistas, para la reposición de escalones y después todo lo que tenía que ver con el arte del mosaico. Posterior a eso, se comenzó a hacer una carta gantt con todo lo que se debía reponer en mosaico y de eso vamos tener que reconstruir tres tramos completos, uno que se dañó bastante y otros dos que están con problemas de deterioro anterior al trabajo de Essal, entonces como la empresa va a financiar la reconstrucción para que quede bien toda la escalera, además queremos enganchar la malla del mosaico a la pisada, se resolvió que se harían los tres tramos completos y los parches. Para esto se debe hacer diseño nuevamente, plotter, mandar a imprimirlos y hacer una selección de colores, muchos de esos colores ya no existen, entonces tenemos que hacerlo con colores nuevos, compra de materiales, etc. Todo esto ya está hecho, estamos trabajando con tres grupos de mosaiquistas del Carnaval del Sur, esperamos tener el arte del mosaico listo, más o menos el veinte, los trabajadores ya comenzaron a trabajar en la escalera y reposición, dentro de los plazos que establecimos, así que vamos bastante bien, esperamos tener todo listo el 30 de marzo o a más tardar la primera semana de abril, toda esta logística se comenzó a realizar después del mes de diciembre.” Por su parte, Sebastián Febres, Gerente General de la Empresa Essal se mostró contento con los avances y el trabajo en la escalera Ricke. ""Estamos muy contentos que el trabajo de normalización de los mosaicos de la escalera Ricke ya esté en marcha y se encuentre en una etapa avanzada, tal como lo hemos ido hablando con los actores que participan de esto. No tenemos que olvidar que esto es producto del diálogo y entendimiento entre el Municipio de Puerto Varas, Carnaval del Sur y nuestra compañía. De nuestra parte, la voluntad de trabajo conjunto va a estar siempre y corresponde a este renovado estilo que queremos implementar de relación con la comunidad como base de esta nueva administración, propia de nuestro nuevo grupo accionista canadiense Liberty"".   ",2022-03-05,
103,47354719.0,chile,elheraldoaustral,https://www.eha.cl/noticia/local/municipio-de-puerto-varas-solicita-reevaluar-financiamiento-de-mejoramiento-del-cerro-philippi-por-aumento-de-costos-13493,Municipio de Puerto Varas solicita reevaluar financiamiento de mejoramiento del Cerro Philippi por aumento de costos,"En la actualidad la iniciativa cuenta con un sobre costo de 21 por ciento, razón por la que el municipio de Puerto Varas solicitó al Gobierno Regional su reevaluación financiera. En la actualidad la iniciativa cuenta con un sobre costo de 21 por ciento, razón por la que el municipio de Puerto Varas solicitó al Gobierno Regional su reevaluación financiera. La evaluación técnica y económica que el equipo municipal realizó al proyecto de mejoramiento del Cerro Philippi  arrojó que el presupuesto original de la iniciativa desarrollada en 2020, actualizado a la fecha, tiene un 21 por ciento de mayor costo por concepto del alza experimentado en los materiales y la mano de obra desde esa fecha. Es así que el municipio desarrolló una propuesta que presentó al Gobierno Regional y la Seremi de Desarrollo Social para reevaluar la iniciativa, financiada vía FNDR, manteniendo las partidas prioritarias del proyecto original. Así lo explicó el director de SECPLA Julián Mingo, señalando que el trabajo de los equipos municipales logró reducir ese sobrecosto a la mitad. “El presupuesto de hace dos años era de 682 millones de pesos y con los costos actuales sobrepasa los 828 millones, es decir un 21 por ciento más. Sin embargo conseguimos reducir ese sobrecosto a la mitad, totalizando 753 millones y esa es la propuesta que vamos a presentar al Gobierno Regional” dijo el directivo. Para eso agregó que “durante este primer semestre ingresaremos el proyecto a reevaluación, enviando un completo informe al Gobierno Regional para que, con su visto bueno, pase a revisión del Ministerio de Desarrollo Social para el RS”. El directivo agregó que de lograrse estos recursos adicionales el municipio estará en condiciones de licitar las obras de mejoramiento del Cerro Philippi, que incluyen entre otras, la consolidación del acceso, estacionamientos, baños públicos, remodelación de la infraestructura existente, accesos universales desde la entrada hasta la explanada superior y la plaza mirador, incluyendo el cierre perimetral para mejorar la seguridad del espacio. De manera paralela, finalizó el director de SECPLA, el municipio trabajará en un modelo de administración y gobernanza participativa orientado a potenciar las oportunidades identificadas en el proceso de diagnóstico. ",2022-03-03,
104,47354898.0,chile,elheraldoaustral,https://www.eha.cl/noticia/local/en-puerto-varas-autoridades-destacan-explosivo-aumento-de-visitas-a-la-region-durante-temporada-estival-2022-13476,En Puerto Varas autoridades destacan “explosivo” aumento de visitas a la región durante temporada estival 2022,"Autoridades regionales, encabezadas por el Delegado Presidencial, Carlos Geisse, se trasladaron al Parque Vicente Pérez Rosales, en la comuna de Puerto Varas, para realizar un balance de lo que fue la temporada estival en la región de Los Lagos. El Delegado Geisse explicó que desde el año 2010 en adelante, en los diez parques y reservas nacionales de la región se ha dado un incremento sostenido en las visitas, que van desde 400 mil  hasta más de 800 mil turistas, que se registraron en el año 2019. Posteriormente esta cifra tuvo una disminución importante debido a la pandemia. Sin embargo, indicó que al comparar el número de visitantes del Parque Vicente Pérez Rosales al mes de enero de 2019, de 125 mil turistas aumentó, este año, a cerca de 140 mil personas que visitaron este lugar. “El turismo ha crecido y vemos que este parque ha mejorado su infraestructura para recibir a los turistas y para hacerlo más cómodo e inclusivo. Estamos muy contentos con esta cifra y esperamos que esto siga mejorando ahora que tenemos la pandemia un poco más controlada”, aseguró Geisse. La Directora Regional de Sernatur, Paulina Ros, señaló que es relevante que gran parte de la oferta que hoy está disponible en la región de Los Lagos esté registrada, se ha notado un aumento explosivo en la visitación respecto al año anterior, pero también se ha superado en las métricas del año 2019-2020. “A través de los parques nacionales, los peajes, aeropuertos, se ha visto un mejor comportamiento del turista nacional en términos del respeto que hay que tener hacia  la naturaleza. Hemos conversando con los gremios y efectivamente el turismo nacional ha sido quien ha levantado la industria y la visitación en la región de Los Lagos”. El Seremi de Economía de la Región de Los Lagos, Francisco Muñoz, sostuvo que la influencia del turismo aporta a una gran cantidad de fuentes laborales estimándose que  21 mil personas se emplean bajo esta actividad que considera rubros como alojamientos, restaurantes,  guías y tour operadores, siendo un aporte importante en la temporada estival. Además destacó que el turista ha mostrado un comportamiento que ya no es “estacionalizado”, es decir no se desarrolla solamente en enero y febrero. Muñoz afirmó que la región de Los Lagos ocupa el tercer lugar como destino turístico, después de la región Metropolitana y Valparaíso. “El PIB del turismo también es relevante, llegando un 4,8% en forma directa y un 11,5% indirecta, siendo además un instrumento económico de muy fácil incorporación, es decir, mujer rurales se incorporan en alojamiento, alimentación y otros productos, es un aporte relevante que hace  el turismo a la economía regional”. El Administrador Subrogante del Parque Nacional Vicente Pérez Rosales y guardaparques, Claudio Rivero detalló que este año en los meses  enero y febrero se registraron 140 mil visitantes, “valoramos el cambio de conciencia de las personas a comparación de otros años, donde se detectaba  presencia de fogatas y otras situaciones, esto ha cambiado y se ha notado el interés por la conservación del área silvestre protegida”. ",2022-03-02,
